9513511,https://www.airbnb.com/rooms/9513511,2.0171E+13,10/2/17,"Beautiful, spacious & sunny bedroom!","This charming pre-war apartment building is located in Pelham Parkway in the north Bronx, within walking distance to the Bronx Zoo and the NY Botanical Gardens. One and a half blocks from the 2 and 5 subway, 30 minute express train ride to Manhattan. Close to many shops, grocery stores, parks, Einstein and Montefiore hospitals, and Fordham University.",,"This charming pre-war apartment building is located in Pelham Parkway in the north Bronx, within walking distance to the Bronx Zoo and the NY Botanical Gardens. One and a half blocks from the 2 and 5 subway, 30 minute express train ride to Manhattan. Close to many shops, grocery stores, parks, Einstein and Montefiore hospitals, and Fordham University. This listing is a bedroom in a 3 bedroom apartment which includes a large & sunny living room with a dining table that can sit 8, a full kitchen with a dishwasher,  a very large hallway with plenty of closets for storage, and a large bathroom with a full tub. My apartment is large, especially for NYC standards, and features beautiful details like original moldings, hardwood floors, a french door, antique light fixtures and tall ceilings. This lovely LARGE 3 bedroom apartment is just one block away from dozens of clothing stores, food chains, restaurants, an incredible taco truck and, most importantly, multiple grocery stores with lots of ",none,"This lovely LARGE 3 bedroom apartment is just one block away from dozens of clothing stores, food chains, restaurants, an incredible taco truck and, most importantly, multiple grocery stores with lots of fresh produce. There is also a Planet Fitness Gym 2 blocks away, as well as a park that many people jog in. For families: this apartment is located just a 10 minute walk from the Bronx Zoo! Also close to the NY Botanical Gardens- 20 minute walk or a short bus ride. For students: Super convenient for Einstein and Montefiore hospital rotation students, as there are many buses near by or you can ride your bike. Also close to Fordham University. In my opinion this is in the very best part of the Bronx! It's quiet and safe. I have lived here for a decade with my children. It is very culturally diverse with people in the community from all over the world. I myself am from Italy! I especially love that it is so close to Arthur Avenue, the real Little Italy of New York, where you can find fres",Laundry is available in the basement of the building,"This apartment is located less than two blocks from the 2 train and express 5 trains, covering just about anywhere in Manhattan you would need to go! There are also many buses just minutes away, though everything you need is across the street in terms of grocery stores, etc.","This listing is a bedroom in a 3 bedroom apartment which includes a large & sunny living room with a dining table that can sit 8, a full kitchen with a dishwasher,  a very large hallway with plenty of closets for storage, and a large bathroom with a full tub. My apartment is large, especially for NYC standards, and features beautiful details like original moldings, hardwood floors, a french door, antique light fixtures and tall ceilings.",,"Please be respectful the neighbors and the apartment itself, thank you!",https://a0.muscache.com/im/pictures/7a7b1af3-922d-42c6-ac75-fb59c377ada8.jpg?aki_policy=small,https://a0.muscache.com/im/pictures/7a7b1af3-922d-42c6-ac75-fb59c377ada8.jpg?aki_policy=medium,https://a0.muscache.com/im/pictures/7a7b1af3-922d-42c6-ac75-fb59c377ada8.jpg?aki_policy=large,https://a0.muscache.com/im/pictures/7a7b1af3-922d-42c6-ac75-fb59c377ada8.jpg?aki_policy=x_large,49293611,https://www.airbnb.com/users/show/49293611,Gloria,11/17/15,"Bronx, NY",Hi!,within a few hours,100%,N/A,f,https://a0.muscache.com/im/pictures/b4d9cf72-b869-4007-9ec4-2e6ec9c7ea4b.jpg?aki_policy=profile_small,https://a0.muscache.com/im/pictures/b4d9cf72-b869-4007-9ec4-2e6ec9c7ea4b.jpg?aki_policy=profile_x_medium,Bronxdale,1,1,"['email', 'phone', 'reviews']",t,f,"Bronx, NY, United States",Bronxdale,Allerton,Bronx,Bronx,NY,10462,New York,"Bronx, NY",US,United States,40.85753243,-73.86605467,t,Apartment,Private room,1,1,1,1,Real Bed,"{TV,Internet,""Wireless Internet"",""Air conditioning"",Kitchen,Elevator,""Buzzer/wireless intercom"",Heating,""Smoke detector"",Essentials,Shampoo,Hangers,""Hair dryer"",Iron,""Laptop friendly workspace"",""translation missing: en.hosting_amenity_49"",""translation missing: en.hosting_amenity_50""}",,$70.00 ,,,$600.00 ,$30.00 ,1,$20.00 ,7,1125,2 weeks ago,t,29,59,89,364,10/2/17,5,7/11/16,9/29/17,88,9,10,10,10,9,10,f,,,f,f,strict,f,f,1,0.33
19174868,https://www.airbnb.com/rooms/19174868,2.0171E+13,10/3/17,Bronx Apartment for travellers,Access to the 2 and 5 train to Manhattan. Cheap retail stores. Close to Bronx zoo as well. Store open 24hrs a day.,,Access to the 2 and 5 train to Manhattan. Cheap retail stores. Close to Bronx zoo as well. Store open 24hrs a day.,none,,,,,,,https://a0.muscache.com/im/pictures/03fd0d71-fe62-47aa-90a6-b3fced03ac88.jpg?aki_policy=small,https://a0.muscache.com/im/pictures/03fd0d71-fe62-47aa-90a6-b3fced03ac88.jpg?aki_policy=medium,https://a0.muscache.com/im/pictures/03fd0d71-fe62-47aa-90a6-b3fced03ac88.jpg?aki_policy=large,https://a0.muscache.com/im/pictures/03fd0d71-fe62-47aa-90a6-b3fced03ac88.jpg?aki_policy=x_large,134100451,https://www.airbnb.com/users/show/134100451,Vitalis,6/8/17,"New York, New York, United States",,within a day,100%,N/A,f,https://a0.muscache.com/im/pictures/458c20b8-7b24-4086-b431-93433d78f48f.jpg?aki_policy=profile_small,https://a0.muscache.com/im/pictures/458c20b8-7b24-4086-b431-93433d78f48f.jpg?aki_policy=profile_x_medium,Allerton,1,1,"['email', 'phone', 'facebook']",t,f,"Bronx, NY, United States",Allerton,Allerton,Bronx,Bronx,NY,10467,New York,"Bronx, NY",US,United States,40.86758804,-73.86852971,t,Apartment,Shared room,1,1,1,1,Real Bed,"{TV,""Wireless Internet"",""Air conditioning"",Kitchen,""Smoke detector"",""Carbon monoxide detector"",""Lock on bedroom door"",Iron}",,$65.00 ,,,,,1,$0.00 ,3,7,4 months ago,t,30,60,90,180,10/3/17,0,,,,,,,,,,f,,,f,f,flexible,f,f,1,
10801360,https://www.airbnb.com/rooms/10801360,2.0171E+13,10/3/17,Studio near BX Botanical Garden,"Studio conveniently located near the original little Italy and Botanical Garden and Bronx Zoo just 5 blocks away. 2 train near by plus express bus to metro north, 4, D, 1, and A train.",,"Studio conveniently located near the original little Italy and Botanical Garden and Bronx Zoo just 5 blocks away. 2 train near by plus express bus to metro north, 4, D, 1, and A train. The entire apartment is only available to rent from Feb 6-18. Will not be available after those dates.",none,,The entire apartment is only available to rent from Feb 6-18. Will not be available after those dates.,,,,No drinking and no smoking allowed. Please clean up after yourself and take out the trash if it gets full.,https://a0.muscache.com/im/pictures/543079f0-6358-47e9-a2ac-f83d10e96891.jpg?aki_policy=small,https://a0.muscache.com/im/pictures/543079f0-6358-47e9-a2ac-f83d10e96891.jpg?aki_policy=medium,https://a0.muscache.com/im/pictures/543079f0-6358-47e9-a2ac-f83d10e96891.jpg?aki_policy=large,https://a0.muscache.com/im/pictures/543079f0-6358-47e9-a2ac-f83d10e96891.jpg?aki_policy=x_large,4149899,https://www.airbnb.com/users/show/4149899,Salam,11/14/12,"New York, New York, United States","I am 23 year old female from California who now lives in New York. I am a vegan, friendly, athletic, and loves outdoor activities. 

I come from a family of 11 (8 girls 1 boy-same parents) I am the middle child. I have a sweet tooth and I currently work in the Restorative Justice field with a concentration on Youth Development. ",within a day,75%,N/A,f,https://a0.muscache.com/im/users/4149899/profile_pic/1400355411/original.jpg?aki_policy=profile_small,https://a0.muscache.com/im/users/4149899/profile_pic/1400355411/original.jpg?aki_policy=profile_x_medium,,2,2,"['email', 'phone', 'reviews', 'kba']",t,t,"Bronx, NY, United States",Allerton,Allerton,Bronx,Bronx,NY,10467,New York,"Bronx, NY",US,United States,40.85959069,-73.8700668,f,Apartment,Entire home/apt,2,1,1,1,Real Bed,"{TV,Internet,""Wireless Internet"",Kitchen,Heating,Essentials,Shampoo}",,$90.00 ,,,,$10.00 ,1,$8.00 ,3,7,6 months ago,t,30,60,90,365,10/3/17,1,9/7/16,9/7/16,100,10,8,10,10,6,10,f,,,f,f,flexible,f,f,2,0.08
8294259,https://www.airbnb.com/rooms/8294259,2.0171E+13,10/3/17,Room in Private House(Queen Bed) by Montefiore-NYC,"Private room with a comfy Queen size bed for one or two people. The unit is located in a quiet safe neighborhood at the 1st level of a private house, so you will feel right at home.  A Queen air mattress in the living room can be provided for 2 additional guests.",,"Private room with a comfy Queen size bed for one or two people. The unit is located in a quiet safe neighborhood at the 1st level of a private house, so you will feel right at home.  A Queen air mattress in the living room can be provided for 2 additional guests. Guest can access the common areas of the house such as the Kitchen, dining room, shared bathroom, living room, Outdoor Patio. You can make espressos with a coffee percolator, or use the tea kettle. Help yourself to pantry Items for cooking.  Feel free to watch Cable TV in the shared living room. WIFI INCLUDED I am typically busy and am periodically at home. If you wish I can gladly show you around town or offer recommendations, as long as I am free. But I am also respectful of your privacy, if you prefer limited interactions. It's a quiet, safe tree-lined neighborhood (Great for running outdoors). Lots of supermarkets, and 24 hr shops and food options.  Landmarks Nearby: Fordham University, Monroe College, Lehman College, Coll",none,"It's a quiet, safe tree-lined neighborhood (Great for running outdoors). Lots of supermarkets, and 24 hr shops and food options.  Landmarks Nearby: Fordham University, Monroe College, Lehman College, College of New Rochelle Nursing, Bronx Community College, City Island, NY Botancial Garden, Orchard Beach, Bronx Zoo, Mall at Bay Plaza, Co-op City, Montefiore, Jacobi, Albert Einstein Weiler College, Gun Hill Brewery, Gun Hill Bowling Alley, 24hr Diner","Free Street Parking. Parking can be found on same street as house  1st level of a private home with no stairs. I will provide the essentials such as fresh towels/linens/soap and shampoo.  A fan, A/C, or space heater can be provided if necessary. My pantry is filled with snacks for your convenience. I have many Games in the living room (Jenga/Taboo/Dominoes/Uno/etc).",24 Hr Taxi Cab Service or Uber available 10 min walk to #2 train (Burke Ave Station) 10 min walk to #5 train (Gun Hill Station) 3 min walk to bus Bx28/ Bx30/ Bx8/ Bx38 10 min walk Express Bus BxM11 and Bx39/ Bx26 Metro North (Harlem Line) 5 min Drive  45 min train ride to Madison Square Garden and Time Square 25 min to LGA airport 45 min to JFK Airport,"Guest can access the common areas of the house such as the Kitchen, dining room, shared bathroom, living room, Outdoor Patio. You can make espressos with a coffee percolator, or use the tea kettle. Help yourself to pantry Items for cooking.  Feel free to watch Cable TV in the shared living room. WIFI INCLUDED","I am typically busy and am periodically at home. If you wish I can gladly show you around town or offer recommendations, as long as I am free. But I am also respectful of your privacy, if you prefer limited interactions.",If you are cooking please clean up after yourselves.  No loud music after 11pm. If you are driving do not block or park in driveway. There is plenty of street parking. No smoking. No pets.,https://a0.muscache.com/im/pictures/106983190/4e685bb8_original.jpg?aki_policy=small,https://a0.muscache.com/im/pictures/106983190/4e685bb8_original.jpg?aki_policy=medium,https://a0.muscache.com/im/pictures/106983190/4e685bb8_original.jpg?aki_policy=large,https://a0.muscache.com/im/pictures/106983190/4e685bb8_original.jpg?aki_policy=x_large,11305944,https://www.airbnb.com/users/show/11305944,Yahaira,1/14/14,"New York, New York, United States","Hello! I am a young professional in management and a native New Yorker. I love to travel and know the feeling of finding a comfortable, clean space in a nice neighborhood when I am away from home. When I travel I truly enjoy experiencing my destination like a local. I hope you get that feeling with my home! 

During my free time I enjoy running outdoors, exploring NYC, Painting, and going out on the town for Salsa Night! I like to have fun and take any opportunity I can to travel! Some of the places I've traveled to are Mexico, Canada, London, various countries in the Carribean, and many US cities (NOLA, Chicago, Dallas,Miami, Minneapolis to name a few).

I am fluent in Spanish and I love meeting people from all cultures.
Being From NYC, Pizza is one of my Favorite foods and I can gladly take you to my favorite pizza shop! ",within an hour,100%,N/A,f,https://a0.muscache.com/im/users/11305944/profile_pic/1442356415/original.jpg?aki_policy=profile_small,https://a0.muscache.com/im/users/11305944/profile_pic/1442356415/original.jpg?aki_policy=profile_x_medium,Baychester,3,3,"['email', 'phone', 'facebook', 'reviews', 'jumio']",t,t,"Bronx, NY, United States",Baychester,Allerton,Bronx,Bronx,NY,10469,New York,"Bronx, NY",US,United States,40.86788703,-73.8599937,f,House,Private room,4,1,1,1,Real Bed,"{TV,""Cable TV"",""Wireless Internet"",""Air conditioning"",Kitchen,""Free parking on premises"",Heating,""Smoke detector"",""Carbon monoxide detector"",Essentials,Shampoo,Hangers,""Hair dryer"",Iron,""Laptop friendly workspace"",""translation missing: en.hosting_amenity_49"",""translation missing: en.hosting_amenity_50"",""Self Check-In"",Keypad}",,$63.00 ,,,$100.00 ,$35.00 ,2,$20.00 ,2,28,a week ago,t,20,50,66,66,10/3/17,23,9/21/15,9/2/17,98,10,10,10,10,9,10,f,,,f,f,moderate,f,f,3,0.93
182177,https://www.airbnb.com/rooms/182177,2.0171E+13,10/3/17,PRIVATE FLAT / APARTMENT- $SPECIAL$,"1st Floor 1 Bedroom Flat/Apartment incl Kitchen, bathroom, living room, Flat Screen TV+internet TV+Hi-Speed WiFi. Neighborhood is safe w/trains,buses, restaurants/supermarkets within walking distance. Close to Fordham University,Yashiva Campus,Montefiore Hospital,Jacoby Hospital,North Central Hospital,Union Hospital, and many other Bronx Hospitals, Bronx Botanical Garden,Bronx Zoo,City Island & Malls. My parents have hosted on Airbnb since 2011. Read our reviews to find out more!","WELCOME TO THE BRONX as featured on CNN's Anthony Bourdain's : Parts Unknown Season 04 Episode 02!  Our apartment is a Wireless Internet equipped Private Flat/Apartment. Only you and your guests will occupy the Flat/Apartment during your stay. The Flat/Apartment has a bedroom, a kitchen, a bathroom, and a living room. For your entertainment the living room has a Flat screen tv + Xbox which gives you access to Fios internet TV. Internet WiFi is very fast allowing you to quickly search and plan your day. For those traveling with a car, our apartment has always available FREE Street Parking right outside the flat/apartment.","1st Floor 1 Bedroom Flat/Apartment incl Kitchen, bathroom, living room, Flat Screen TV+internet TV+Hi-Speed WiFi. Neighborhood is safe w/trains,buses, restaurants/supermarkets within walking distance. Close to Fordham University,Yashiva Campus,Montefiore Hospital,Jacoby Hospital,North Central Hospital,Union Hospital, and many other Bronx Hospitals, Bronx Botanical Garden,Bronx Zoo,City Island & Malls. My parents have hosted on Airbnb since 2011. Read our reviews to find out more! WELCOME TO THE BRONX as featured on CNN's Anthony Bourdain's : Parts Unknown Season 04 Episode 02!  Our apartment is a Wireless Internet equipped Private Flat/Apartment. Only you and your guests will occupy the Flat/Apartment during your stay. The Flat/Apartment has a bedroom, a kitchen, a bathroom, and a living room. For your entertainment the living room has a Flat screen tv + Xbox which gives you access to Fios internet TV. Internet WiFi is very fast allowing you to quickly search and plan your day. For tho",none,"Situated right in the heart of the Bronx where you're a direct subway ride into Manhattan. You can reach all tourist destinations including Grand Central Station, Times Square, 9/11 Memorial, and all others from our apartment.  If your destination is the Bronx you're in arms length to all major highways, close to all Bronx hospitals, a short bus ride to Fordham University, and within walking distance to the world famous New York Botanical Garden and Bronx Zoo.","PETS POLICY  We do allow pets, maximum 2--no weight limit, but we consider them an extra paying guest at $25 per night per pet, plus an additional $100 cleaning fee. Please estimate $25 x (# of Nights for each pet) + $100 cleaning fee. Pets must be house trained, and groomed(showered and cleaned) prior to arrival. Pets must be curbed at all times (Picked up afterwards - in and outside of the house). Any pet damage must be reported to us immediately via Airbnb. Please contact us for more details. LARGE GROUPS (Over four (4) Adults) Our recommended maximum is five (5) Adults if your group wants a comfortable place to sleep. We have a King bed, a Twin Bed, and a Futon in the apartment. We provide additional Air Mattresses as needed. Keep in mind there is only one bathroom to share amongst your group. If you're okay with this set up, we'll happily host you. :)","The Flat/Apartment is located close to two major subway lines that take you directly into Manhattan without transfers. Plan for an hour ride with walking/waiting for the train. The 2 line takes you along the west side of Manhattan, and the 5 line takes you along the east side of Manhattan. Both train lines are a 8-12 minutes away on foot. There is a bus you can catch that stops directly in front of the apartment which will take you to 4 subway lines, 2, 4, B, and the D lines. We recommend taking the 5 train just four blocks away between 6am and 9am to catch the EXPRESS, you'll get to Grand Central in 40 minutes, and a great place to start your day.",My parents (your hosts) are conveniently located above and are available if you need them throughout your stay. You will have access to all amenities in the apartment. Please see all our amenities provided in the amenities section.,"Our parents love welcoming all our guests, getting to know a little about you, and offering tips and advice about New York City. But as this listing is for a private apartment, interaction will be as much or as little as you desire it to be.","1) You're in New York City for a limited time, be sure to enjoy all of it!!! Have fun and spend the day in New York City as much as you can!! 2) Enjoy the Apartment, but please be respectful of our apartment and our property in it. 3) Absolutely NO smoking in the house. You may go across the street where you may smoke outside.  4) No over night guests NOT included in your reservation. 5) No pets are allowed on the premises unless otherwise permitted and included in your reservation as an additional PAYING guest. See our Pets Policy for more information in ""Other Things to Note"" section.  6) Make sure to clean up after yourself, including use of the kitchen.   7) For long term stays, if you need to receive mail please get a PO box or arrange to have your mail collected elsewhere.  8) Feel free to use the stove and the fridge. If you use the stove please make sure it is turned off after you are done. Please also make sure to remove all of your food from the fridge when you leave. Yes, ev",https://a0.muscache.com/im/pictures/3070080/756d956d_original.jpg?aki_policy=small,https://a0.muscache.com/im/pictures/3070080/756d956d_original.jpg?aki_policy=medium,https://a0.muscache.com/im/pictures/3070080/756d956d_original.jpg?aki_policy=large,https://a0.muscache.com/im/pictures/3070080/756d956d_original.jpg?aki_policy=x_large,873273,https://www.airbnb.com/users/show/873273,Christian & Carla,7/26/11,"New York, New York, United States","Hi Everyone,

We're Christian and Carla, and our family hopes to host your stay in New York City. 

Feel at home while you're in New York City. We have an extra bedroom in our parent's apartment that is available for your New York City visit! We have the misfortune that we may likely not meet during your visit, but our parents are the best hosts -- just read our reviews from previous guests! Throughout the entire Airbnb process we will keep communication with you all the way until after check-out, and we always do our best to quickly respond to any questions.

Our family and us look forward to making your New York City stay an affordable and memorable one.

Be sure to visit all our listings and reserve your New York City Holiday/Vacation with us!

Christian & Carla",within an hour,100%,N/A,f,https://a0.muscache.com/im/users/873273/profile_pic/1355433517/original.jpg?aki_policy=profile_small,https://a0.muscache.com/im/users/873273/profile_pic/1355433517/original.jpg?aki_policy=profile_x_medium,Baychester,4,4,"['email', 'phone', 'facebook', 'amex', 'reviews', 'jumio', 'kba']",t,t,"Bronx, NY, United States",Baychester,Allerton,Bronx,Bronx,NY,10469,New York,"Bronx, NY",US,United States,40.86465805,-73.85708739,t,Apartment,Entire home/apt,8,1,1,3,Real Bed,"{TV,Internet,""Wireless Internet"",""Air conditioning"",Kitchen,""Pets allowed"",Heating,""Family/kid friendly"",""Smoke detector"",""Carbon monoxide detector"",""First aid kit"",""Safety card"",""Fire extinguisher"",Essentials,Shampoo,Hangers,""Hair dryer"",Iron,""Laptop friendly workspace"",""Self Check-In"",Keypad}",,$125.00 ,,,$150.00 ,$50.00 ,4,$25.00 ,2,28,3 weeks ago,t,10,33,58,330,10/3/17,224,9/4/11,10/2/17,92,9,9,10,10,9,9,f,,,t,f,strict,t,t,4,3.02
