id,listing_url,scrape_id,last_scraped,name,summary,space,description,experiences_offered,neighborhood_overview,notes,transit,access,interaction,house_rules,thumbnail_url,medium_url,picture_url,xl_picture_url,host_id,host_url,host_name,host_since,host_location,host_about,host_response_time,host_response_rate,host_acceptance_rate,host_is_superhost,host_thumbnail_url,host_picture_url,host_neighbourhood,host_listings_count,host_total_listings_count,host_verifications,host_has_profile_pic,host_identity_verified,street,neighbourhood,neighbourhood_cleansed,neighbourhood_group_cleansed,city,state,zipcode,market,smart_location,country_code,country,latitude,longitude,is_location_exact,property_type,room_type,accommodates,bathrooms,bedrooms,beds,bed_type,amenities,square_feet,price,weekly_price,monthly_price,security_deposit,cleaning_fee,guests_included,extra_people,minimum_nights,maximum_nights,calendar_updated,has_availability,availability_30,availability_60,availability_90,availability_365,calendar_last_scraped,number_of_reviews,first_review,last_review,review_scores_rating,review_scores_accuracy,review_scores_cleanliness,review_scores_checkin,review_scores_communication,review_scores_location,review_scores_value,requires_license,license,jurisdiction_names,instant_bookable,is_business_travel_ready,cancellation_policy,require_guest_profile_picture,require_guest_phone_verification,calculated_host_listings_count,reviews_per_month
18461891,https://www.airbnb.com/rooms/18461891,2.0171E+13,10/3/17,"Bright, comfortable 1B studio near everything!","*Looking to fill these specific dates: June 24 - June 28  Cozy 1 Bedroom/1 Bathroom studio apartment on the top floor of a prewar building, conveniently located 2.5 blocks from your choice of 2 N/W stations, just a 20 minute ride to Manhattan. Cafes, restaurants, wine shops, grocery and a CVS nearby. Laundromat around the corner. The beautiful riverside Astoria Park is only a 15 minute walk from the building.","Very well illuminated space includes comfortable queen bed and AC in bedroom, TV (connected to web-streaming) in common area, and fully functional kitchen with housewares. Some storage space will be available.","*Looking to fill these specific dates: June 24 - June 28  Cozy 1 Bedroom/1 Bathroom studio apartment on the top floor of a prewar building, conveniently located 2.5 blocks from your choice of 2 N/W stations, just a 20 minute ride to Manhattan. Cafes, restaurants, wine shops, grocery and a CVS nearby. Laundromat around the corner. The beautiful riverside Astoria Park is only a 15 minute walk from the building. Very well illuminated space includes comfortable queen bed and AC in bedroom, TV (connected to web-streaming) in common area, and fully functional kitchen with housewares. Some storage space will be available. IMPORTANT: This space is not suitable for children, as there are two windows that open to cleared fire escapes. The view is very pretty, but we (and the state of New York, by law) require that guests do not sit out on the fire escape. Guests must confirm that they agree to this safety precaution prior to confirmation. The apartment is on the top floor of a 4 story pre-war bu",none,"There are Michelin-rated restaurants in the area, trendy bars and cafes, a Key Foods supermarket (as well as a farmer's market grocery), and a CVS. As the area is historically Greek, there are also wonderful Greek restaurants. In the summertime, Astoria park is a beautiful place for a picnic overlooking the river, with a view of Manhattan on the other side.",,"Astoria is a safe and quaint neighborhood, and our apartment is located only 2 blocks from a train line that gets you to midtown Manhattan in 20 minutes. It's a perfect respite from the crowds, while still closer to Central Park, major museums, and popular attractions than many tri-borough locations!","IMPORTANT: This space is not suitable for children, as there are two windows that open to cleared fire escapes. The view is very pretty, but we (and the state of New York, by law) require that guests do not sit out on the fire escape. Guests must confirm that they agree to this safety precaution prior to confirmation. The apartment is on the top floor of a 4 story pre-war building with stairs. A garbage key will be provided for disposal on the first level.",Arrangements will be made in advance regarding key pick up and delivery.,,https://a0.muscache.com/im/pictures/8ac331a9-3691-49fa-ba77-22c3cc428f1f.jpg?aki_policy=small,https://a0.muscache.com/im/pictures/8ac331a9-3691-49fa-ba77-22c3cc428f1f.jpg?aki_policy=medium,https://a0.muscache.com/im/pictures/8ac331a9-3691-49fa-ba77-22c3cc428f1f.jpg?aki_policy=large,https://a0.muscache.com/im/pictures/8ac331a9-3691-49fa-ba77-22c3cc428f1f.jpg?aki_policy=x_large,916092,https://www.airbnb.com/users/show/916092,Connie Mae,8/3/11,"New York, New York, United States",sensation(URL HIDDEN),N/A,N/A,N/A,f,https://a0.muscache.com/im/pictures/2bdfa9ca-aaaf-491d-aaee-4906e65fa0b9.jpg?aki_policy=profile_small,https://a0.muscache.com/im/pictures/2bdfa9ca-aaaf-491d-aaee-4906e65fa0b9.jpg?aki_policy=profile_x_medium,Astoria,1,1,"['email', 'phone', 'facebook', 'reviews', 'kba']",t,t,"Queens, NY, United States",Astoria,Ditmars Steinway,Queens,Queens,NY,11105,New York,"Queens, NY",US,United States,40.77414229,-73.916246,t,Apartment,Entire home/apt,2,1,0,1,Real Bed,"{TV,""Wireless Internet"",""Air conditioning"",Kitchen,""Smoke detector"",""Carbon monoxide detector"",""First aid kit"",""Safety card"",Essentials,""Hair dryer"",""translation missing: en.hosting_amenity_49"",""translation missing: en.hosting_amenity_50""}",,$110.00 ,,,$250.00 ,$85.00 ,1,$0.00 ,6,6,5 months ago,t,0,0,0,0,10/3/17,0,,,,,,,,,,f,,,f,f,strict,f,f,1,
20702398,https://www.airbnb.com/rooms/20702398,2.0171E+13,10/3/17,Quiet house on City Island,"1 private bedroom and bathroom available for one or two guests on the second floor (owner lives on the first floor). The house has a full kitchen, washer/dryer in the basement, living room, and a beautiful backyard. Street parking is available. Grocery story is one block away. Easy access to the Bx29 bus service to the 6 train. We're about 1 hour from Manhattan via the express 6 train. Less than 90 minutes to 51st street.",,"1 private bedroom and bathroom available for one or two guests on the second floor (owner lives on the first floor). The house has a full kitchen, washer/dryer in the basement, living room, and a beautiful backyard. Street parking is available. Grocery story is one block away. Easy access to the Bx29 bus service to the 6 train. We're about 1 hour from Manhattan via the express 6 train. Less than 90 minutes to 51st street. kitchen, laundry, living room, back yard My schedule varies week-to-week. I usually work from home so I'm around to help if needed. This neighborhood is dope! Lot's of seafood restaurants, a few bars, yacht clubs, a couple places to see live music. The locals are the best part of City Island. They are very friendly. This is a slice of New England in New York City. Orchard beach is very close, a short bike trip or a long walk. walk! The island is only 1.5 miles long. Public transportation and car service is available to take guests off the island No loud parties or har",none,"This neighborhood is dope! Lot's of seafood restaurants, a few bars, yacht clubs, a couple places to see live music. The locals are the best part of City Island. They are very friendly. This is a slice of New England in New York City. Orchard beach is very close, a short bike trip or a long walk.",No loud parties or hard drugs There is wifi but no tv,walk! The island is only 1.5 miles long. Public transportation and car service is available to take guests off the island,"kitchen, laundry, living room, back yard",My schedule varies week-to-week. I usually work from home so I'm around to help if needed.,No third-party bookings,https://a0.muscache.com/im/pictures/7c0a47b7-5d23-4304-9474-78c24ba9b3d7.jpg?aki_policy=small,https://a0.muscache.com/im/pictures/7c0a47b7-5d23-4304-9474-78c24ba9b3d7.jpg?aki_policy=medium,https://a0.muscache.com/im/pictures/7c0a47b7-5d23-4304-9474-78c24ba9b3d7.jpg?aki_policy=large,https://a0.muscache.com/im/pictures/7c0a47b7-5d23-4304-9474-78c24ba9b3d7.jpg?aki_policy=x_large,1457680,https://www.airbnb.com/users/show/1457680,James,11/30/11,"Bronx, New York, United States","Hi! Welcome to my airbnb listing. Things you should know about me: I work in media, I read a lot, make art, and listen to music (anything funky, always funky music). I take care of my body and mind. Um, sleep is important to me and that's why I love this house! It's so relaxing and quiet here. If you're seeking a chill place to spend some time, this is the right spot for you. ",within an hour,100%,N/A,f,https://a0.muscache.com/im/pictures/user/389c4027-4e61-4585-a4d3-3cb86c430fc6.jpg?aki_policy=profile_small,https://a0.muscache.com/im/pictures/user/389c4027-4e61-4585-a4d3-3cb86c430fc6.jpg?aki_policy=profile_x_medium,,1,1,"['email', 'phone', 'reviews']",t,f,"Bronx, NY, United States",City Island,City Island,Bronx,Bronx,NY,,New York,"Bronx, NY",US,United States,40.84919062,-73.78650889,f,House,Private room,2,1,1,1,Real Bed,"{""Wireless Internet"",""Air conditioning"",Kitchen,Breakfast,Heating,""Family/kid friendly"",Washer,Dryer,""Smoke detector"",""Fire extinguisher"",Essentials,Hangers,""Hair dryer""}",,$50.00 ,,,$500.00 ,$20.00 ,1,$0.00 ,1,21,2 weeks ago,t,19,49,79,169,10/3/17,2,9/17/17,10/1/17,100,10,10,10,10,10,10,f,,,f,f,moderate,f,f,1,2
6627449,https://www.airbnb.com/rooms/6627449,2.0171E+13,10/3/17,Large 1 BDRM in Great location,"This ground floor apartment is light and airy with a fully equipped kitchen. Located in the heart of City Island w/ shops, restaurants and transportation nearby. If needed there is extra sleeping space on the modular sofa.","We are close to fishing, boating, biking, horseback riding or hiking.  We are near Orchard Beach and Pelham Bay Park.  This is a very convenient area.","This ground floor apartment is light and airy with a fully equipped kitchen. Located in the heart of City Island w/ shops, restaurants and transportation nearby. If needed there is extra sleeping space on the modular sofa. We are close to fishing, boating, biking, horseback riding or hiking.  We are near Orchard Beach and Pelham Bay Park.  This is a very convenient area. The entire apartment is available as I am only there part of the time.  There is a patio in back off the living room.  You are welcome to help yourself to coffee or tea. My daughter and her family live on the Island and will be there to greet you and help you out with any information you might like. City Island is a unique and a hidden gem of New York City.  Many New  Yorkers do  not even know it exists.  It is known for its seafood and sailing, with many seafood restaurants in various price ranges.  We are close to grocery stores, library, City Island Diner, antique stores and art galleries. It is a very safe and walk",none,"City Island is a unique and a hidden gem of New York City.  Many New  Yorkers do  not even know it exists.  It is known for its seafood and sailing, with many seafood restaurants in various price ranges.  We are close to grocery stores, library, City Island Diner, antique stores and art galleries. It is a very safe and walkable neighborhood. City Island is only 11/2 miles long and (3) blocks wide at its widest, with 2 seafood restaurants at the end with outdoor do it yourself seating",There is off street parking in the apartment complex.  I have a reserved space which you would be able to use.,We are (2) blocks from the BX29 bus which you can take to the Pelham Bay subway station. ( a 10 minute ride)  From there you can transfer to the #6 train to Manhattan; about 45 minutes.,The entire apartment is available as I am only there part of the time.  There is a patio in back off the living room.  You are welcome to help yourself to coffee or tea.,My daughter and her family live on the Island and will be there to greet you and help you out with any information you might like.,There is no smoking and no pets.  Otherwise use the place as you would your own.,https://a0.muscache.com/im/pictures/83539171/13fe7e85_original.jpg?aki_policy=small,https://a0.muscache.com/im/pictures/83539171/13fe7e85_original.jpg?aki_policy=medium,https://a0.muscache.com/im/pictures/83539171/13fe7e85_original.jpg?aki_policy=large,https://a0.muscache.com/im/pictures/83539171/13fe7e85_original.jpg?aki_policy=x_large,13886510,https://www.airbnb.com/users/show/13886510,Arlene,4/4/14,"Los Angeles, California, United States",,within an hour,100%,N/A,f,https://a0.muscache.com/im/users/13886510/profile_pic/1433129533/original.jpg?aki_policy=profile_small,https://a0.muscache.com/im/users/13886510/profile_pic/1433129533/original.jpg?aki_policy=profile_x_medium,City Island,1,1,"['email', 'phone', 'reviews', 'kba']",t,t,"City Island, NY, United States",City Island,City Island,Bronx,City Island,NY,10464,New York,"City Island, NY",US,United States,40.84977457,-73.78660939,t,Apartment,Entire home/apt,3,1,1,1,Real Bed,"{TV,Internet,""Wireless Internet"",""Air conditioning"",Kitchen,""Free parking on premises"",""Buzzer/wireless intercom"",Heating,""Family/kid friendly"",Washer,Dryer,""Smoke detector"",""Carbon monoxide detector"",Essentials,Shampoo,Hangers,""Hair dryer"",Iron}",,$125.00 ,$775.00 ,,,$75.00 ,1,$0.00 ,3,21,2 weeks ago,t,28,58,88,363,10/3/17,21,7/4/15,9/26/17,95,10,10,10,10,10,10,f,,,f,f,strict,f,f,1,0.77
19949243,https://www.airbnb.com/rooms/19949243,2.0171E+13,10/3/17,Stay aboard  a sailboat,stay aboard a sailboat,,stay aboard a sailboat,none,,,,,,,https://a0.muscache.com/im/pictures/15f33093-3002-401b-84e4-69157c25cc8f.jpg?aki_policy=small,https://a0.muscache.com/im/pictures/15f33093-3002-401b-84e4-69157c25cc8f.jpg?aki_policy=medium,https://a0.muscache.com/im/pictures/15f33093-3002-401b-84e4-69157c25cc8f.jpg?aki_policy=large,https://a0.muscache.com/im/pictures/15f33093-3002-401b-84e4-69157c25cc8f.jpg?aki_policy=x_large,1149260,https://www.airbnb.com/users/show/1149260,MoMo,9/12/11,"New York, New York, United States",,within a few hours,100%,N/A,f,https://a0.muscache.com/im/pictures/39a34f0a-3a31-4f38-8aa7-6fbcab6955a9.jpg?aki_policy=profile_small,https://a0.muscache.com/im/pictures/39a34f0a-3a31-4f38-8aa7-6fbcab6955a9.jpg?aki_policy=profile_x_medium,,1,1,"['email', 'phone', 'facebook']",t,f,"Bronx, NY, United States",The Bronx,City Island,Bronx,Bronx,NY,10464,New York,"Bronx, NY",US,United States,40.84883794,-73.78227587,f,Boat,Entire home/apt,4,1,1,3,Real Bed,{},,$100.00 ,,,$0.00 ,$30.00 ,1,$0.00 ,3,1125,6 days ago,t,30,60,90,90,10/3/17,0,,,,,,,,,,f,,,t,f,strict,f,f,1,
1886820,https://www.airbnb.com/rooms/1886820,2.0171E+13,10/3/17,Quaint City Island Community. ,"Quiet island  boating town on Long Island Sound. 10 miles from Manhattan. Public trans. Walk to shops, restaurants, bars,parks. Near Botanical gardens, Bronx Zoo and Fordham University. Water view. off street parking. 3BR, 3 Full Baths. Washer/dryer. full kitchen.Fully furnished comfortable home with deck/backyard. local caretaker."," Master bed with queen bed, full bath and office.  Mid bedroom has queen bed.  Small bed has single. TV room/den queen sleeper sofa. Galley kitchen off dining room.  Piano.  Winter water view.  Large back deck with seating.  Small front porch. Great for family of 4.  Will fit 7.  Additional$25.00 per person per night over 4 people.","Quiet island  boating town on Long Island Sound. 10 miles from Manhattan. Public trans. Walk to shops, restaurants, bars,parks. Near Botanical gardens, Bronx Zoo and Fordham University. Water view. off street parking. 3BR, 3 Full Baths. Washer/dryer. full kitchen.Fully furnished comfortable home with deck/backyard. local caretaker.  Master bed with queen bed, full bath and office.  Mid bedroom has queen bed.  Small bed has single. TV room/den queen sleeper sofa. Galley kitchen off dining room.  Piano.  Winter water view.  Large back deck with seating.  Small front porch. Great for family of 4.  Will fit 7.  Additional$25.00 per person per night over 4 people. 2 story 1800 sq ft house all to yourselves. Local caretaker available during stay. We will be available by phone Small New England type town in the middle of the big city.  Small Island in the Long Island Sound.  Local marinas, seafood restaurants, yacht clubs, supermarket, library, shops. Parking available in driveway.  Bus stop ",none," Small New England type town in the middle of the big city.  Small Island in the Long Island Sound.  Local marinas, seafood restaurants, yacht clubs, supermarket, library, shops.",,"Parking available in driveway.  Bus stop around the corner.  Near Orchard Beach, Bronx Zoo, World Famous Botanical Gardens, Fordham University and of course, Manhattan   ",2 story 1800 sq ft house all to yourselves. ,Local caretaker available during stay. We will be available by phone,No smoking.  No pets.  This is our private home.  We expect that you would treat it with care and enjoy it as we do.,,,https://a0.muscache.com/im/pictures/26266928/14c688d9_original.jpg?aki_policy=large,,9815788,https://www.airbnb.com/users/show/9815788,Steve,11/4/13,US,,N/A,N/A,N/A,f,https://a0.muscache.com/im/users/9815788/profile_pic/1383845917/original.jpg?aki_policy=profile_small,https://a0.muscache.com/im/users/9815788/profile_pic/1383845917/original.jpg?aki_policy=profile_x_medium,City Island,1,1,"['email', 'phone']",t,f,"Bronx, NY, United States",City Island,City Island,Bronx,Bronx,NY,10464,New York,"Bronx, NY",US,United States,40.84114416,-73.78305229,t,House,Entire home/apt,4,3,3,3,Real Bed,"{TV,""Cable TV"",Internet,""Wireless Internet"",""Air conditioning"",Kitchen,""Free parking on premises"",Heating,Washer,Dryer}",,$300.00 ,,,$800.00 ,$100.00 ,4,$25.00 ,7,90,16 months ago,t,30,60,90,365,10/3/17,0,,,,,,,,,,f,,,f,f,strict,f,f,1,
5557381,https://www.airbnb.com/rooms/5557381,2.0171E+13,10/3/17,Quaint City Island Home,"Located in an old sea-shanty town, our home has a countryside feel, only an hour away from Manhattan's excitement! With a bed big enough for two it's ideal for business-(wo)men or out-of-towners who don't want the hustle/bustle to follow them home.","You won't find a place so close to the city (NYC of course) with such a big back yard! There's lots to do. We are only a train ride away from Manhattan in all it's glory - we live a bus ride or a 10 min car ride from the Pelham Bay station on the 6 line, to Grand Central it's less than an hour and a half by public transport, less than an hour if you drive to the train - and there's plenty to do on City Island as well (or 'the island' as we locals call it). There are oodles of seafood restaurants withing walking distance (including a wonderful diner just a block away that has the best breakfast), swimming in Eastchester Bay during the summer, bike trails, Pelham Bay Park and Orchard beach! If you're looking for some combination of the NYC life with outdoor adventure, this is the place for you! *DISCLAIMER*: If you are looking for a place from which to explore Manhattans night life, this is probably not the place for you. The public bus that runs from the end of the 6 train onto City Isl","Located in an old sea-shanty town, our home has a countryside feel, only an hour away from Manhattan's excitement! With a bed big enough for two it's ideal for business-(wo)men or out-of-towners who don't want the hustle/bustle to follow them home. You won't find a place so close to the city (NYC of course) with such a big back yard! There's lots to do. We are only a train ride away from Manhattan in all it's glory - we live a bus ride or a 10 min car ride from the Pelham Bay station on the 6 line, to Grand Central it's less than an hour and a half by public transport, less than an hour if you drive to the train - and there's plenty to do on City Island as well (or 'the island' as we locals call it). There are oodles of seafood restaurants withing walking distance (including a wonderful diner just a block away that has the best breakfast), swimming in Eastchester Bay during the summer, bike trails, Pelham Bay Park and Orchard beach! If you're looking for some combination of the NYC lif",none,"City Island is unique in two ways. First, you get the small community feel, juxtaposed with NEW YORK CITY. Weird right? A small community, surrounded by water and parkland, so close to such a city!   The second reason I love my neighborhood is it's history. City Island used to be a oyster/fishing village (there are still places to rent boats and fishing equipment for those interested), and many inhabitants were boat builders ((website hidden)). City Island even has it's own Nautical Museum, if you need a weekend afternoon activity.","I am going to put this in a few places (also above in the overall description) as this has been a little bit of an issue for past guests: If you are looking for a place from which to explore Manhattans night life, this is probably not the place for you. The public bus that runs from the end of the 6 train onto City Island stops running a little before midnight.  However, if you only want to do day trips, explore the Bronx (or Queens), and come back to a quiet house with no traffic sounds, this is the perfect location.","The easiest way to get to Manhattan quickly is to drive to the Hunts Point station on the 6 train (this gets you to midtown in a little under an hour). If driving isn't your thing, there is a public bus (the Bx29) that runs from City Island to the Pelham Bay station (the last station on the 6 line in the Bronx), this option will take you a little less than an hour and a half to get to midtown manhattan. Fare is now $2.75 per ride, and comes with a free transfer. Parking is available on the street in front of the property (we do have a driveway in a pinch, but it's a little inconvenient).",The house is just a place to sleep (and cook and shower). We have a great big back yard (by city standards) with a picnic table for outdoor diners. There is also a garage space with weights and some boxing equipment for the exercise-inclined.,"I live in the back house (there are two houses on the property, my father lives in the front house) full time. The house is generally empty during weekdays, but the living room, kitchen and bathroom are shared spaces, so interaction will be inevitable. However, I'm pretty laid back. As long as you do your dishes! ;)","Only a few actual rules: 1. Don't smoke in the house. There is a beautiful back yard for that. 2. Strip the bed before you check out and leave the sheets in a pile on the bed so I can just grab them and throw them in the wash. 3. Take out the trash on our way out as you leave. The garbage is located to the left of the stair as you're exiting the front door. 4. Check to make sure ALL windows are closed before using the heat or ac. There are a lot, don't give up, this ends up in a LOT of wasted energy in an already energy-high house! Other than that, I'm a very reasonable person. I'll try to respect your space and clean up after myself while you're here, and I expect you to do the same. Nobody gets everything exactly right the first time and 2nd chances make the world go round, but that doesn't mean we shouldn't do our best. I love pets. Furry, scaly, feathery, doesn't matter. Pets are not only allowed, they're encouraged! I don't have a pet at the moment, but that very well may change!",https://a0.muscache.com/im/pictures/85805287/7c6b38ae_original.jpg?aki_policy=small,https://a0.muscache.com/im/pictures/85805287/7c6b38ae_original.jpg?aki_policy=medium,https://a0.muscache.com/im/pictures/85805287/7c6b38ae_original.jpg?aki_policy=large,https://a0.muscache.com/im/pictures/85805287/7c6b38ae_original.jpg?aki_policy=x_large,28811542,https://www.airbnb.com/users/show/28811542,Phoebe,3/5/15,"New York, New York, United States","My name is Phoebe. Both my parents are biologists, and it looks like it's contagious. My favorite mode of travel is my own two feet (sometimes with the help of a canoe). I have many passions, but two of them are learning about the natural world, and showing people how wonderful it is! I've lead canoe trips in northern Ontario, trail crews in Colorado and Virginia, and I'm always looking for the next adventure. 

I've been a part of  the Air BnB community since 2015, and I love meeting new people and exchanging stories. I keep my plate very full, so I do not cook for guests, and sometimes my house gets a little messy, but I make sure to keep common areas clear and clean for your use. I have refurbished the house mostly on my own (with help from friends and family for the heavy lifting of course), and I'm welcome to suggestions for updates!

(you'll see french on the list of languages spoken, I speak only a little french because I went to school on Montrèal)",within an hour,100%,N/A,t,https://a0.muscache.com/im/pictures/43cb9adc-f198-47cb-ba44-8a737440e825.jpg?aki_policy=profile_small,https://a0.muscache.com/im/pictures/43cb9adc-f198-47cb-ba44-8a737440e825.jpg?aki_policy=profile_x_medium,City Island,1,1,"['email', 'phone', 'reviews', 'jumio']",t,t,"Bronx, NY, United States",City Island,City Island,Bronx,Bronx,NY,10464,New York,"Bronx, NY",US,United States,40.85002381,-73.78932759,t,House,Private room,4,1,1,1,Real Bed,"{Internet,""Wireless Internet"",""Air conditioning"",Kitchen,""Free parking on premises"",""Pets allowed"",Gym,Heating,""Family/kid friendly"",""Smoke detector"",""Carbon monoxide detector"",""First aid kit"",Essentials,""Lock on bedroom door"",""Laptop friendly workspace"",""translation missing: en.hosting_amenity_50""}",,$69.00 ,$350.00 ,"$1,200.00 ",,$17.00 ,2,$15.00 ,3,1125,a week ago,t,0,22,50,325,10/3/17,94,5/25/15,7/31/17,97,10,10,10,10,10,10,f,,,t,f,moderate,f,f,1,3.27
