19609887,https://www.airbnb.com/rooms/19609887,2.0171E+13,10/2/17,Sweet Getaway,"Getaway for two (2) or up to seven (7), nice spacious apartment with a view of Manhattan Skyline.  There are two bedrooms available for rental for up to 7 guests which can fit in the two bedrooms based on # of beds.","$150 first  two guests per night, $25 each additional guest up to 7 additional guests.  $50 cleaning fee, $5/day for wifi. There are two bedrooms available for rental for up to 7 guests which can fit in the two bedrooms based on # of beds.  There is a Queen bed in bedroom 1 and two sets of bunk beds in bedroom 2 bunk beds are one twin/twin and one twin/full.","Getaway for two (2) or up to seven (7), nice spacious apartment with a view of Manhattan Skyline.  There are two bedrooms available for rental for up to 7 guests which can fit in the two bedrooms based on # of beds. $150 first  two guests per night, $25 each additional guest up to 7 additional guests.  $50 cleaning fee, $5/day for wifi. There are two bedrooms available for rental for up to 7 guests which can fit in the two bedrooms based on # of beds.  There is a Queen bed in bedroom 1 and two sets of bunk beds in bedroom 2 bunk beds are one twin/twin and one twin/full. Shower bathroom, kitchen, K-cups coffee maker, toaster, microwave, refrigerator, oven, cooking utensils, eating utensils, bath towels, washer/dryer, hair blow dryer, iron, ironing board and there is only one tv which is located in the living room.  (Please note the bedrooms do not have TV's in them). I am reachable by phone or txt to answer any/all your questions. If you enjoy seafood, City Island is the place to be. Th",none,"If you enjoy seafood, City Island is the place to be.","Please note there is only one tv which is located in the living room.  There are no TV's in any of the bedrooms. Please note previous guest indicated there was a strong tobacco/cigar smell in the rooms.  There is a cigar store located directly below the apartment.  Therefore, if you are sensitive to tobacco smell, traveling with children, asthmatic, etc please do not book this apartment, as there will be no refunds.  Thank you.","There is nearby public transportation and if you have a rental vehicle, there is a spot to park.","Shower bathroom, kitchen, K-cups coffee maker, toaster, microwave, refrigerator, oven, cooking utensils, eating utensils, bath towels, washer/dryer, hair blow dryer, iron, ironing board and there is only one tv which is located in the living room.  (Please note the bedrooms do not have TV's in them).",I am reachable by phone or txt to answer any/all your questions.,- Smoking allowed outside on the balcony only.  Quiet time after 11pm.  Additional rules upon reservation will be discussed directly with renter.,https://a0.muscache.com/im/pictures/8230374d-4ce8-4600-8f2f-7dd0de60c009.jpg?aki_policy=small,https://a0.muscache.com/im/pictures/8230374d-4ce8-4600-8f2f-7dd0de60c009.jpg?aki_policy=medium,https://a0.muscache.com/im/pictures/8230374d-4ce8-4600-8f2f-7dd0de60c009.jpg?aki_policy=large,https://a0.muscache.com/im/pictures/8230374d-4ce8-4600-8f2f-7dd0de60c009.jpg?aki_policy=x_large,137892083,https://www.airbnb.com/users/show/137892083,Gladis,6/30/17,"New York, New York, United States","Mother of two who enjoys reading, quiet relaxed times.  Can't live without my girls and we would love to make it to Hawaii on one of our vacation getaways.  ",within an hour,100%,N/A,f,https://a0.muscache.com/im/pictures/6b66e2d2-ba98-4293-9f3d-676b2730dd13.jpg?aki_policy=profile_small,https://a0.muscache.com/im/pictures/6b66e2d2-ba98-4293-9f3d-676b2730dd13.jpg?aki_policy=profile_x_medium,City Island,1,1,"['email', 'phone', 'reviews']",t,f,"Bronx, NY, United States",City Island,City Island,Bronx,Bronx,NY,10464,New York,"Bronx, NY",US,United States,40.85197955,-73.78930423,t,Apartment,Entire home/apt,7,1,2,5,Real Bed,"{TV,""Air conditioning"",Kitchen,""Free parking on premises"",Heating,""Family/kid friendly"",Washer,Dryer,""Smoke detector"",Essentials,""Lock on bedroom door"",Hangers,""Hair dryer"",Microwave,""Coffee maker"",Refrigerator,""Dishes and silverware"",""Cooking basics"",Oven,Stove,""Patio or balcony""}",,$150.00 ,,,"$1,000.00 ",$50.00 ,2,$25.00 ,2,1125,a week ago,t,24,54,74,74,10/2/17,3,8/7/17,9/24/17,100,10,10,10,10,10,10,f,,,f,f,flexible,f,f,1,1.58
7949480,https://www.airbnb.com/rooms/7949480,2.0171E+13,10/3/17,City Island Sanctuary BR & Private Bath w Parking,"Relax on City Island in our quiet guest room w/adjacent private bath. Enjoy a Continental Breakfast served by Didier at your table downstairs. Take lessons at New York Sailing Center just 3 blocks away. Walk to the beach around the corner, restaurants, shops, the park or Orchard Beach. Park one car on our private driveway.  For Manhattan you can take the BX29  bus to the subway 6 train or the BXM8 express bus. There are green taxis at the subway.","On parle français et anglais, (lire le français ci-dessous). I am a native New Yorker and Didier grew up in Biarritz, France.  Our three friendly cats do not go into the room.  The bathroom is yours during your entire stay (we have our own en suite).  We will provide a Continental breakfast with fresh bread butter & jams, fresh squeezed orange juice or fresh fruit,  tea or coffee served by my French husband who is a talented cook!  You might even get a special treat of canelés de Bordeaux, banana bread or home made scones! City Island Sanctuary relaxing BR & Bath w Parking Pièce calme, ensoleillée et à proximité d'une salle de bain privée. Marchez jusqu, au parc ou à la plage. On peut aller à pied à quelques restaurants, une petite supermarché, petits magasins et le City Island Nautical Museum. Prenez le metro ou le bus express à Manhattan (une heure et demi à centre-ville.   Les chats sont en résidence, mais ne vont pas dans la chambre. Cable TV avec TV5 Monde, lecteur DVD, Wi-fi . Pe","Relax on City Island in our quiet guest room w/adjacent private bath. Enjoy a Continental Breakfast served by Didier at your table downstairs. Take lessons at New York Sailing Center just 3 blocks away. Walk to the beach around the corner, restaurants, shops, the park or Orchard Beach. Park one car on our private driveway.  For Manhattan you can take the BX29  bus to the subway 6 train or the BXM8 express bus. There are green taxis at the subway. On parle français et anglais, (lire le français ci-dessous). I am a native New Yorker and Didier grew up in Biarritz, France.  Our three friendly cats do not go into the room.  The bathroom is yours during your entire stay (we have our own en suite).  We will provide a Continental breakfast with fresh bread butter & jams, fresh squeezed orange juice or fresh fruit,  tea or coffee served by my French husband who is a talented cook!  You might even get a special treat of canelés de Bordeaux, banana bread or home made scones! City Island Sanctuar",none,"City Island is a unique sanctuary in New York City's the Bronx.  It boasts many wonderful seafood restaurants, two great pubs and the only true French bistro in the borough.  We are walking distance to the largest park in the City of New York, Pelham Bay Park and also to lovely Orchard Beach, the Riviera of the Bronx!","We are walkable to Pelham Park which is the largest park in NYC.  It has picnic areas, tennis courts, horseback riding, Orchard Beach  and a lovely rocky coast.  Check out their website for all there is to do!","On the island, you can walk to everything.  A local bus will take you to shopping at the Mall at Bay Plaza near Coop City. If you want to go to Manhattan  you take the local 29 bus to the subway No. 6 to Manhattan.  The local bus does not run after midnight but there are green taxis at the subway station.  There is an express bus early in the morning which goes directly from the island to Manhattan.  It will take at least one hour to get to midtown by subway and a bit longer on the express bus depending upon traffic.","Feel free to enjoy our large backyard in season, our downstairs large recreation area with TV, WIFI. Walk to the local beaches for the view or a dip.  Please, no food or drinks except water in the guest bedroom.","We speak fluent French and English.  We will be in residence during your stay to help you with recommendations for a real New York experience or a unique City Island French experience.  But, we do respect your privacy!","No extra guests or visitors who are not in the reservation.  Maximum 2 registered guests only.  No late check ins or check outs. Please,  no food or drinks in the guest bedroom except water.  No smoking on the property.  It's a residential neighborhood so we keep it quiet after 10.  Please only inquire about booking for yourself, we will not accept 3rd party inquiries.",https://a0.muscache.com/im/pictures/001d1cb0-6ef2-4074-bd39-e486ee58d00f.jpg?aki_policy=small,https://a0.muscache.com/im/pictures/001d1cb0-6ef2-4074-bd39-e486ee58d00f.jpg?aki_policy=medium,https://a0.muscache.com/im/pictures/001d1cb0-6ef2-4074-bd39-e486ee58d00f.jpg?aki_policy=large,https://a0.muscache.com/im/pictures/001d1cb0-6ef2-4074-bd39-e486ee58d00f.jpg?aki_policy=x_large,119445,https://www.airbnb.com/users/show/119445,Linda & Didier,5/6/10,"New York, New York, United States","I am a designer, former instructor at a design school and my husband is a talented French cook (he is from France).  He is also an artist, writer and a Zen practitioner.  We are sociable but respectful of your privacy.  
I am a native New Yorker having relocated back to NYC from So Cal because I Love New York!  We are the only French/American Airbnb in the Bronx!
",within an hour,100%,N/A,t,https://a0.muscache.com/im/pictures/2de30fe4-bebe-4145-a86a-b8a8a970078d.jpg?aki_policy=profile_small,https://a0.muscache.com/im/pictures/2de30fe4-bebe-4145-a86a-b8a8a970078d.jpg?aki_policy=profile_x_medium,City Island,1,1,"['email', 'phone', 'reviews', 'jumio']",t,t,"Bronx, NY, United States",City Island,City Island,Bronx,Bronx,NY,10464,New York,"Bronx, NY",US,United States,40.85205378,-73.78867963,t,House,Private room,2,1,1,1,Real Bed,"{""Cable TV"",""Wireless Internet"",""Air conditioning"",""Free parking on premises"",Breakfast,""Pets live on this property"",Cat(s),""Indoor fireplace"",Heating,""Smoke detector"",""Carbon monoxide detector"",""Fire extinguisher"",Essentials,Shampoo,Hangers,""Hair dryer"",Iron,""translation missing: en.hosting_amenity_49"",""translation missing: en.hosting_amenity_50"",""Garden or backyard"",""Host greets you""}",,$101.00 ,,,$100.00 ,$0.00 ,1,$20.00 ,1,7,4 days ago,t,29,59,89,179,10/2/17,31,1/18/16,9/1/17,100,10,10,10,10,10,10,f,,,f,f,moderate,t,t,1,1.49
21057372,https://www.airbnb.com/rooms/21057372,2.0171E+13,10/3/17,Relax and unwind on the water.,On City Island step away from all City Island has to offer. Im offering a 2 bed 2 BathRoom 36 foot yatch in North Minneford Marina.,,On City Island step away from all City Island has to offer. Im offering a 2 bed 2 BathRoom 36 foot yatch in North Minneford Marina.,none,,,,,,,https://a0.muscache.com/im/pictures/76839742-dae4-4b24-af62-d12b150d5346.jpg?aki_policy=small,https://a0.muscache.com/im/pictures/76839742-dae4-4b24-af62-d12b150d5346.jpg?aki_policy=medium,https://a0.muscache.com/im/pictures/76839742-dae4-4b24-af62-d12b150d5346.jpg?aki_policy=large,https://a0.muscache.com/im/pictures/76839742-dae4-4b24-af62-d12b150d5346.jpg?aki_policy=x_large,151702414,https://www.airbnb.com/users/show/151702414,David,9/22/17,US,,within a few hours,100%,N/A,f,https://a0.muscache.com/im/pictures/user/638dd523-f27a-4c77-a81f-d6c701a8e8cb.jpg?aki_policy=profile_small,https://a0.muscache.com/im/pictures/user/638dd523-f27a-4c77-a81f-d6c701a8e8cb.jpg?aki_policy=profile_x_medium,,1,1,['phone'],t,f,"Bronx, NY, United States",City Island,City Island,Bronx,Bronx,NY,10464,New York,"Bronx, NY",US,United States,40.84212398,-73.78519698,f,Boat,Entire home/apt,4,1.5,2,2,Real Bed,"{TV,""Wireless Internet"",""Air conditioning"",Kitchen,""Free parking on premises"",""Smoke detector"",""Carbon monoxide detector"",""First aid kit"",""Fire extinguisher"",Essentials,""Host greets you""}",,$100.00 ,,,$500.00 ,$50.00 ,1,$100.00 ,1,1125,3 days ago,t,29,59,89,364,10/2/17,0,,,,,,,,,,f,,,t,f,strict,f,f,1,
16042478,https://www.airbnb.com/rooms/16042478,2.0171E+13,10/3/17,WATERFRONT STUDIO APARTMENT,"My place is close to Sea Shore. You’ll love my place because of the coziness, the location, the views, and the people. My place is good for couples, solo adventurers, business travelers, and families (with kids).",(URL HIDDEN),"My place is close to Sea Shore. You’ll love my place because of the coziness, the location, the views, and the people. My place is good for couples, solo adventurers, business travelers, and families (with kids). (URL HIDDEN) public transport from Grand Central, NYC or from JFK, Laguadia is about 30 minutes away. (URL HIDDEN) Fine sea food restaurant, bars and night clubs all within walking distance, Sailing, fishing, canoeing, marinas and just 30 minutes away from central NYC or major airports like JFK or LaGuardia airports.  Enjoy NYC",none,(URL HIDDEN),"Fine sea food restaurant, bars and night clubs all within walking distance, Sailing, fishing, canoeing, marinas and just 30 minutes away from central NYC or major airports like JFK or LaGuardia airports.  Enjoy NYC",,"public transport from Grand Central, NYC or from JFK, Laguadia is about 30 minutes away.",,,https://a0.muscache.com/im/pictures/bb5bc3c4-3eb2-4b90-a2c8-28401c6eabcc.jpg?aki_policy=small,https://a0.muscache.com/im/pictures/bb5bc3c4-3eb2-4b90-a2c8-28401c6eabcc.jpg?aki_policy=medium,https://a0.muscache.com/im/pictures/bb5bc3c4-3eb2-4b90-a2c8-28401c6eabcc.jpg?aki_policy=large,https://a0.muscache.com/im/pictures/bb5bc3c4-3eb2-4b90-a2c8-28401c6eabcc.jpg?aki_policy=x_large,9117975,https://www.airbnb.com/users/show/9117975,Collins,9/29/13,"New York, New York, United States","I am married with 3 children and 2 grandkid.  Family and community is the most important thing besides God.  I am a Tax consultant and a I have travelled to a few countries including Germany, France, Holland, Netherlands, England in Europe.  I have also travel extensively within the Caribbean and Mexico so I appreciate the importance of comfortable and affordable  lodging when one is away.",N/A,N/A,N/A,f,https://a0.muscache.com/im/users/9117975/profile_pic/1423794446/original.jpg?aki_policy=profile_small,https://a0.muscache.com/im/users/9117975/profile_pic/1423794446/original.jpg?aki_policy=profile_x_medium,City Island,1,1,"['phone', 'facebook']",t,f,"Bronx, NY, United States",City Island,City Island,Bronx,Bronx,NY,10464,New York,"Bronx, NY",US,United States,40.85349119,-73.78860659,t,Apartment,Private room,4,1,1,1,Real Bed,"{TV,Internet,""Wireless Internet"",""Air conditioning"",Kitchen,Heating,""Family/kid friendly"",""Smoke detector"",""Carbon monoxide detector"",""First aid kit"",""Fire extinguisher"",Essentials,Shampoo,Hangers,""Hair dryer"",Iron}",,$200.00 ,,,,,1,$0.00 ,7,29,11 months ago,t,30,60,90,180,10/3/17,0,,,,,,,,,,f,,,t,f,flexible,f,f,1,
9147025,https://www.airbnb.com/rooms/9147025,2.0171E+13,10/3/17,Cozy City Island Cottage,City Island is a small community at the edge of New York City just beyond Pelham Bay Park in the Bronx and surrounded by the waters of the Long Island Sound and Eastchester Bay. Enjoy the water views and seafood restaurants or nearby Orchard Beach.,"This cozy little cottage is an open floor plan with a queen size murphy bed. There is brand new bathroom, eat in kitchen, large fenced in yard, perfect for BBQ's or sitting under the full grown apple tree. The living room has lots of windows and a partial view of the sound and Manhattan. There are two bikes available for use. The location is walking distance to many of the islands best eateries,  bars, Nautical Museum, and historic City Island Cemetery . Beautiful Pelham Park is close by, where you can enjoy the boardwalk at Orchard Beach or hike and bike the many trails.  Fishing charters also available. Enjoyable get away any time of the year. You will forget you are even in the Bronx, and be transported to New England. City Island is a hidden gem.","City Island is a small community at the edge of New York City just beyond Pelham Bay Park in the Bronx and surrounded by the waters of the Long Island Sound and Eastchester Bay. Enjoy the water views and seafood restaurants or nearby Orchard Beach. This cozy little cottage is an open floor plan with a queen size murphy bed. There is brand new bathroom, eat in kitchen, large fenced in yard, perfect for BBQ's or sitting under the full grown apple tree. The living room has lots of windows and a partial view of the sound and Manhattan. There are two bikes available for use. The location is walking distance to many of the islands best eateries,  bars, Nautical Museum, and historic City Island Cemetery . Beautiful Pelham Park is close by, where you can enjoy the boardwalk at Orchard Beach or hike and bike the many trails.  Fishing charters also available. Enjoyable get away any time of the year. You will forget you are even in the Bronx, and be transported to New England. City Island is a hi",none,"City Island is famous for it's seafood restaurants both large and small, casual and fancy. The Crab Shanty, Sammy's, The Lobster Box, Portofino's and the Seashore, which also has a large bar with live music on Fridays and boasts a happy hour with drink specials. There are also several other restaurants to choose from that have a variety of offerings. A City Island local favorite is The Black Whale, which also has a sunday bunch, Arties; italain food, Don Coqui, Puerto Rician food, Bistro SK, french, and Ohana with table side hibachi. End your night at Paddy's On The Island, which is always filled with colorful locals and sometimes live music.","Please note that it is a 15 minute bus ride to the NYC subway system. Although it is not required to enjoy your stay, having a car is helpful. There is small beach/cement deck at the end of the block, 3 houses down. The house is NOT on the water. You can see the water from the windows in the living/bed room. This beach access is for residents of Caroll Street only and gate is locked after dark. Orchard Beach in Pelham Bay Park is close by and is a public beach.",City Island is a walkable Island. Everything is very close. It is helpful to have a car if you want to venture further off the Island. The city subway system is a bus ride away. The MTA bus service takes approximately 15 minutes from City Island to the Pelham Bay 6 train subway stop. The subway ride into Manhattan from there is approximately 1 hour. There is also a MTA Express bus into Manhattan that runs on a limited schedule from City Island Ave. stops to stops in Manhattan. Please consult the MTA website before booking or email me if you have questions.,This is a whole private house on a charming quiet residential street. You will have use of the large fenced in back yard. Private driveway for one car.,I live close by and know the area well if you have any issues or questions. Friendly and helpful neighbors. Quiet street.,No Smoking,https://a0.muscache.com/im/pictures/abbac002-c8a5-44da-9405-4897e73667c6.jpg?aki_policy=small,https://a0.muscache.com/im/pictures/abbac002-c8a5-44da-9405-4897e73667c6.jpg?aki_policy=medium,https://a0.muscache.com/im/pictures/abbac002-c8a5-44da-9405-4897e73667c6.jpg?aki_policy=large,https://a0.muscache.com/im/pictures/abbac002-c8a5-44da-9405-4897e73667c6.jpg?aki_policy=x_large,403032,https://www.airbnb.com/users/show/403032,Diane,2/21/11,"New York, New York, United States",,within an hour,100%,N/A,t,https://a0.muscache.com/im/pictures/dc275952-e2d7-463e-93a5-994fa8c31e04.jpg?aki_policy=profile_small,https://a0.muscache.com/im/pictures/dc275952-e2d7-463e-93a5-994fa8c31e04.jpg?aki_policy=profile_x_medium,,1,1,"['email', 'phone', 'facebook', 'reviews']",t,f,"Bronx, NY, United States",City Island,City Island,Bronx,Bronx,NY,10464,New York,"Bronx, NY",US,United States,40.84486957,-73.7895405,f,House,Entire home/apt,2,1,0,1,Real Bed,"{TV,""Wireless Internet"",""Air conditioning"",Kitchen,""Free parking on premises"",Heating,""Family/kid friendly"",Washer,Dryer,""Smoke detector"",""Carbon monoxide detector"",""Safety card"",Essentials,Shampoo,""24-hour check-in"",Hangers,""Hair dryer"",Iron,""Laptop friendly workspace"",""Self Check-In"",Lockbox}",,$125.00 ,$550.00 ,,$500.00 ,$35.00 ,1,$0.00 ,2,28,4 days ago,t,18,45,53,137,10/2/17,60,12/26/15,10/1/17,97,10,10,10,10,10,10,f,,,f,t,moderate,f,f,1,2.78
1936633,https://www.airbnb.com/rooms/1936633,2.0171E+13,10/3/17,Great 1BD waterfront City Island NY,,"I am renting my lovely one bedroom apartment that is located in a waterfront property with nice view over Long Island Sound. It is a great place to relax if you need to work in NYC, and still would like to feel on your own island! If you love the city, and do not want to forgo a nice outdoor life, my place cannot get any better for you, biking or hiking to NYC's largest park (Pelham Bay Park), fishing, boating, golf, horseback riding, jogging. For beach lovers, the Orchard Beach is also in fair walking distance. ","I am renting my lovely one bedroom apartment that is located in a waterfront property with nice view over Long Island Sound. It is a great place to relax if you need to work in NYC, and still would like to feel on your own island! If you love the city, and do not want to forgo a nice outdoor life, my place cannot get any better for you, biking or hiking to NYC's largest park (Pelham Bay Park), fishing, boating, golf, horseback riding, jogging. For beach lovers, the Orchard Beach is also in fair walking distance. Relax in the garden directly on the beach.  The house has a large shared garden with direct access to the beach, you will not believe you are in NYC!  You can use Canoe or Kayak and BBQ grill in summer. The place is very conveniently located in City Island, a lovely historic place famous for its seafood and sailing traditions. It is a very safe place, and everything is in walking distance, bars, coffee shops, grocery stores, art stores, banks, post office, and some of the best ",none,"The place is very conveniently located in City Island, a lovely historic place famous for its seafood and sailing traditions. It is a very safe place, and everything is in walking distance, bars, coffee shops, grocery stores, art stores, banks, post office, and some of the best seafood restaurants of NYC ",,"For commuting to New York City, you can take BX-29 bus to Pelham Bay Park subway station, and then take the 6 line Express to Manhattan. It will take you about 45 minutes to 1 hour to get to midtown. There is also an express bus from City Island to Manhattan, as an alternative for commuting. ","Relax in the garden directly on the beach.  The house has a large shared garden with direct access to the beach, you will not believe you are in NYC!  You can use Canoe or Kayak and BBQ grill in summer.",,No smoking and no pets.,https://a0.muscache.com/im/pictures/75425672/4b34161a_original.jpg?aki_policy=small,https://a0.muscache.com/im/pictures/75425672/4b34161a_original.jpg?aki_policy=medium,https://a0.muscache.com/im/pictures/75425672/4b34161a_original.jpg?aki_policy=large,https://a0.muscache.com/im/pictures/75425672/4b34161a_original.jpg?aki_policy=x_large,10018391,https://www.airbnb.com/users/show/10018391,Alex,11/14/13,"New York, New York, United States",Mechanical Engineer,a few days or more,33%,N/A,f,https://a0.muscache.com/im/users/10018391/profile_pic/1384470843/original.jpg?aki_policy=profile_small,https://a0.muscache.com/im/users/10018391/profile_pic/1384470843/original.jpg?aki_policy=profile_x_medium,City Island,1,1,"['email', 'phone', 'reviews']",t,f,"Bronx, NY, United States",City Island,City Island,Bronx,Bronx,NY,10464,New York,"Bronx, NY",US,United States,40.85258204,-73.78762098,t,Apartment,Entire home/apt,2,1,1,2,Real Bed,"{TV,""Cable TV"",Internet,""Wireless Internet"",""Air conditioning"",Kitchen,Heating,""Family/kid friendly"",""Smoke detector"",""Carbon monoxide detector"",Essentials,Shampoo,""24-hour check-in"",Hangers,""Hair dryer"",Iron}",800,$115.00 ,$660.00 ,"$1,950.00 ",$0.00 ,$50.00 ,2,$10.00 ,3,30,4 weeks ago,t,0,0,0,0,10/2/17,49,1/21/14,5/23/17,99,10,10,10,10,10,10,f,,,t,f,strict,f,f,1,1.09
