19758402,https://www.airbnb.com/rooms/19758402,2.0171E+13,10/3/17,Autumn getaway -House near beach & woodland trails,"City Island is a quaint coastal town located 45 minutes from midtown Manhattan. Take the bus to the 6 train or the express bus to midtown. Bus stop is one block away.  Why stay in the city when you can stay nearby and get the best of both worlds?  Explore City Island which is located inside Pelham Bay Park. Fishing, swimming, kayaking, charter boats, bird watching, miniature golf, horse back riding hiking & biking trails. Visit the The New York Botanical Garden, Bronx Zoo, & Bartow Pell Mansion.","Three bedroom house. Queen, twin and empty room perfect for air mattress upstairs. Two bathrooms. One shower. Limited cooking.","City Island is a quaint coastal town located 45 minutes from midtown Manhattan. Take the bus to the 6 train or the express bus to midtown. Bus stop is one block away.  Why stay in the city when you can stay nearby and get the best of both worlds?  Explore City Island which is located inside Pelham Bay Park. Fishing, swimming, kayaking, charter boats, bird watching, miniature golf, horse back riding hiking & biking trails. Visit the The New York Botanical Garden, Bronx Zoo, & Bartow Pell Mansion. Three bedroom house. Queen, twin and empty room perfect for air mattress upstairs. Two bathrooms. One shower. Limited cooking. Enjoy the fall beauty of the changing leaves. Woodland trails began a few blocks away and take you into the forests of Pelham Bay Park while skirting the rocky shoreline of Long Island Sound. A real fall getaway and vacation. There's also a Private block beach accessible all day and night and around the corner from the home's  garden.  You can enjoy the 1/8 mile beach a",none,"Beautiful East Coast nature setting. Walk/bike the trails to Orchard Beach, Hunter Island and Twin Island. Short drive to the Bronx Zoo, New York Botanical Garden and Bartow Pell Mansion.  If you are going into Manhattan by public transportation please take note of the time you return. Buses stop running close to midnight. Uber or green cabs are available in case you want to stay longer in the city.","City Island is a safe neighborhood. It's only 1 1/4 mile long with 4,000 people. There's one way on and off over a small bridge which keeps any crime extremely low. Parking is on the street. There is a security camera located in a remote part of the kitchen to watch for a leaky pipe that was fixed last year.","You can bike around, or drive or walk. There are nature trails everywhere. If you walk the trails apply bug spray. Like any coastal town there may be mosquitoes and ticks on the trails.  Transportation to Manhattan is the BX29 bus and the #6 train. It's about 40 minutes in a one fare zone. Transfer from bus to train. Buses stop around midnight. Uber is a good way to get back from the city but can be costly.  The BX29 bus to the Bx12 bus will take you to the Bronx Zoo, and New York Botanical Garden ((URL HIDDEN) It's a one fare transfer.  The BX29 will take you to Co-op City which has a large shopping area with department stores and book store.","Enjoy the fall beauty of the changing leaves. Woodland trails began a few blocks away and take you into the forests of Pelham Bay Park while skirting the rocky shoreline of Long Island Sound. A real fall getaway and vacation. There's also a Private block beach accessible all day and night and around the corner from the home's  garden.  You can enjoy the 1/8 mile beach at LOW TIDE.  There's a low tide twice a day. At high tide there is a smaller beach to enjoy. You can look up the tide cycles for high and low tide The beach is on the bay side and suitable for swimming at high or low tides. Beach combing is encouraged for shells, smooth rocks and sea glass.",There is a caretaker/tenant in residence. Her private room is on the first floor and away from your private rooms on the second floor.,#NAME?,https://a0.muscache.com/im/pictures/6fcac0e0-f6a2-423d-94f6-38f3a3b9051f.jpg?aki_policy=small,https://a0.muscache.com/im/pictures/6fcac0e0-f6a2-423d-94f6-38f3a3b9051f.jpg?aki_policy=medium,https://a0.muscache.com/im/pictures/6fcac0e0-f6a2-423d-94f6-38f3a3b9051f.jpg?aki_policy=large,https://a0.muscache.com/im/pictures/6fcac0e0-f6a2-423d-94f6-38f3a3b9051f.jpg?aki_policy=x_large,139415761,https://www.airbnb.com/users/show/139415761,Deb,7/9/17,US,,within an hour,100%,N/A,f,https://a0.muscache.com/im/pictures/aa092da9-5a7b-429e-8f54-29f194632c06.jpg?aki_policy=profile_small,https://a0.muscache.com/im/pictures/aa092da9-5a7b-429e-8f54-29f194632c06.jpg?aki_policy=profile_x_medium,City Island,1,1,"['phone', 'reviews']",t,f,"Bronx, NY, United States",City Island,City Island,Bronx,Bronx,NY,10464,New York,"Bronx, NY",US,United States,40.8530609,-73.78948149,t,House,Entire home/apt,4,2,3,3,Real Bed,"{""Wireless Internet"",""Air conditioning"",Kitchen,Breakfast,Heating,""Family/kid friendly"",""Smoke detector"",""Carbon monoxide detector"",""Fire extinguisher"",Essentials,Hangers,""Hair dryer"",""Laptop friendly workspace"",""Private entrance"",""Hot water"",""Bed linens"",Microwave,""Coffee maker"",Refrigerator,""Dishes and silverware"",Stove,""Garden or backyard"",Waterfront,Beachfront}",,$62.00 ,,,"$1,000.00 ",$75.00 ,4,$10.00 ,2,9,today,t,19,49,79,79,10/2/17,9,7/23/17,9/25/17,87,8,8,10,9,9,9,f,,,f,f,moderate,f,f,1,3.7
11675715,https://www.airbnb.com/rooms/11675715,2.0171E+13,10/2/17,Cozy 1 BR Basement Apartment,"City Island is an active, year-round nautical community at the edge of NYC just beyond Pelham Bay Park in the Bronx and surrounded by the waters of the L.I. Sound and Eastchester Bay.Walk to restaurants, shops, galleries, yacht clubs and marinas.","This very cozy apartment with features a queen size bed and a new queen size sofa bed. It's ceilings are a 8' feet tall. There is a full  bathroom, kitchen and eating area. The location is walking distance to many of the islands best eateries, bars, Nautical Museum, and historic City Island Cemetery . Beautiful Pelham Park is close by, where you can enjoy the boardwalk at Orchard Beach or hike and bike the many trails. Fishing charters also available. Enjoyable get away any time of the year. You will forget you are even in the Bronx, and be transported to New England. City Island is a slice of heaven.","City Island is an active, year-round nautical community at the edge of NYC just beyond Pelham Bay Park in the Bronx and surrounded by the waters of the L.I. Sound and Eastchester Bay.Walk to restaurants, shops, galleries, yacht clubs and marinas. This very cozy apartment with features a queen size bed and a new queen size sofa bed. It's ceilings are a 8' feet tall. There is a full  bathroom, kitchen and eating area. The location is walking distance to many of the islands best eateries, bars, Nautical Museum, and historic City Island Cemetery . Beautiful Pelham Park is close by, where you can enjoy the boardwalk at Orchard Beach or hike and bike the many trails. Fishing charters also available. Enjoyable get away any time of the year. You will forget you are even in the Bronx, and be transported to New England. City Island is a slice of heaven. The entire apartment is available. You are welcome to help yourself to coffee and tea. I live in the vicinity and know the area well, if you hav",none,"City Island is a small island and a neighborhood approximately 1.5 miles (2.4 km) long[2] by 0.5 miles (0.80 km) wide. City Island is a small community at the edge of New York City located just beyond Pelham Bay Park in the Bronx and surrounded by the waters of the Long Island Sound and Eastchester Bay. With Execution Light to the northeast and Stepping Stones Lighthouse to the south, City Island has a rich nautical history, much of it preserved by the Historical Society and Museum.","You have access to all Basic Cable Channels, Sports Channels,premium cable channels (HBO, SHOTIME) and Netflix( on the Smart TV).","The easiest way to get to Manhattan quickly is to drive to the Hunts Point station on the 6 train (this gets you to midtown in a little under an hour). If driving isn't your thing, there is a public bus (the Bx29) that runs from City Island to the Pelham Bay station (the last station on the 6 line in the Bronx), this option will take you a little less than an hour and a half to get to midtown manhattan. Fare is now $2.75 per ride, and comes with a free transfer. Parking is available on the street in front of the property (we do have a driveway in a pinch, but it's a little inconvenient).",The entire apartment is available. You are welcome to help yourself to coffee and tea.,"I live in the vicinity and know the area well, if you have any issues or questions please feel free to reach me.","• Check-in time is 3PM.  Check-out time is 11:00AM. No Smoking, No pets.",https://a0.muscache.com/im/pictures/55160e33-921f-432f-a425-e9110ff4359c.jpg?aki_policy=small,https://a0.muscache.com/im/pictures/55160e33-921f-432f-a425-e9110ff4359c.jpg?aki_policy=medium,https://a0.muscache.com/im/pictures/55160e33-921f-432f-a425-e9110ff4359c.jpg?aki_policy=large,https://a0.muscache.com/im/pictures/55160e33-921f-432f-a425-e9110ff4359c.jpg?aki_policy=x_large,56714504,https://www.airbnb.com/users/show/56714504,Josue,1/30/16,"New York, New York, United States","I'm from NYC ,and love travelling and eco adventures. My philosophy in life is to work hard and enjoy life to its fullest.",within an hour,100%,N/A,t,https://a0.muscache.com/im/pictures/deff1bc3-aafc-4a3a-83c8-25558598bfe2.jpg?aki_policy=profile_small,https://a0.muscache.com/im/pictures/deff1bc3-aafc-4a3a-83c8-25558598bfe2.jpg?aki_policy=profile_x_medium,City Island,1,1,"['email', 'phone', 'reviews', 'jumio', 'offline_government_id', 'kba', 'government_id', 'work_email']",t,t,"City Island, NY, United States",City Island,City Island,Bronx,City Island,NY,10464,New York,"City Island, NY",US,United States,40.85139148,-73.78413887,t,House,Entire home/apt,4,1,1,2,Real Bed,"{TV,""Cable TV"",Internet,""Wireless Internet"",""Air conditioning"",Kitchen,""Free parking on premises"",Heating,""Family/kid friendly"",""Smoke detector"",""Carbon monoxide detector"",""First aid kit"",""Safety card"",""Fire extinguisher"",Essentials,Shampoo,""24-hour check-in"",Hangers,""Hair dryer"",Iron,""Laptop friendly workspace""}",,$85.00 ,,,,$30.00 ,2,$10.00 ,1,1125,5 days ago,t,12,35,59,332,10/2/17,110,3/21/16,9/11/17,98,10,10,10,10,10,10,f,,,t,t,flexible,f,f,1,5.88
3400359,https://www.airbnb.com/rooms/3400359,2.0171E+13,10/3/17,Awesome Deal NYC,"Beautiful, cozy  and comfortable room in a welcoming and hospitable family, near restaurants, train, bus, Jacobi hospital, Albert Einstein College of Medicine, Montefiore hospital, Fordham University, Lehman college and more.","Room is on the second floor of the house. Our home is located in a clean, safe, and quiet neighborhood where you can retreat after an exhausting day of sightseeing. Shared bathroom and kitchen","Beautiful, cozy  and comfortable room in a welcoming and hospitable family, near restaurants, train, bus, Jacobi hospital, Albert Einstein College of Medicine, Montefiore hospital, Fordham University, Lehman college and more. Room is on the second floor of the house. Our home is located in a clean, safe, and quiet neighborhood where you can retreat after an exhausting day of sightseeing. Shared bathroom and kitchen Kitchen, backyard, Patio, shared bathroom, living room, free Wi-Fi, microwave, toaster, refrigerator, free street parking, free tea/coffee, fresh clean towel and linen. We work but will answer all your questions.  We will give you your space if you desire. Our home  is conveniently located in the North Bronx in a family oriented  residential neighborhood. Very quiet, clean and with easy reach to downtown Manhattan. Nearby attractions include the Zoo, Botanical garden, Yankee Stadium, Bronx museum of Arts. Restaurants in a walking distance include; IHOP, White Castle, Popeye'",none,"Our home  is conveniently located in the North Bronx in a family oriented  residential neighborhood. Very quiet, clean and with easy reach to downtown Manhattan. Nearby attractions include the Zoo, Botanical garden, Yankee Stadium, Bronx museum of Arts. Restaurants in a walking distance include; IHOP, White Castle, Popeye's, McDonald, Dunkin Donut, Chinese restaurants. Jacobi and Montefiore hospitals, Fordham University, Lehman College, Bay Plaza shopping mall.",,"10 min walk to #2 train   3 minutes walk  to bus #26.  Easy access to LGA, JFK and Newark airports Easy access to Manhattan and other attractions","Kitchen, backyard, Patio, shared bathroom, living room, free Wi-Fi, microwave, toaster, refrigerator, free street parking, free tea/coffee, fresh clean towel and linen.",We work but will answer all your questions.  We will give you your space if you desire.,"Feel comfortable, feel at home, enjoy your stay There is no curfew-you come and go anytime.   ABSOLUTELY NO SMOKING INSIDE OR OUTSIDE THE HOUSE OR ILLEGAL DRUG ACTIVITIES. NO PETS Please keep your room, bathroom, kitchen clean.  No food in the room, please eat in the dinning room, drinks are ok. No shoes in the rooms, please bring a pair of socks or flip flops ( house slippers). Please unplug all electrical devices when you go out Conserve energy by turning the lights off when not in use.  Thank you.",https://a0.muscache.com/im/pictures/61044713/5e8a90f8_original.jpg?aki_policy=small,https://a0.muscache.com/im/pictures/61044713/5e8a90f8_original.jpg?aki_policy=medium,https://a0.muscache.com/im/pictures/61044713/5e8a90f8_original.jpg?aki_policy=large,https://a0.muscache.com/im/pictures/61044713/5e8a90f8_original.jpg?aki_policy=x_large,16286162,https://www.airbnb.com/users/show/16286162,Pat,6/2/14,"New York, New York, United States","HEY  I'M  PAT

 I enjoy the simple things in life, a positive person and always looking for the good in others. I love to travel,  entertain, outdoor activities, gardening, meet new people, exchange culture and our individual uniqueness.  I live in our private  house with my husband, daughter and older brother.
  I am a high school  Guidance Counselor.  I love  the bubbling life in New York City- ""the City that Never Sleeps"".

It has been a wonderful experience meeting  and hosting awesome guests from all walks of life. My family and i may not have traveled to all 5 continents that you all come from, but we have shared laughter, experiences  and pleasantries with you all because you chose to stay with us. THANK YOU.
 Looking forward to meeting our future  guests.

Please upload your photograph before booking.


",within an hour,100%,N/A,f,https://a0.muscache.com/im/pictures/9f6cea33-8e0f-4d24-884d-9d003f269cd6.jpg?aki_policy=profile_small,https://a0.muscache.com/im/pictures/9f6cea33-8e0f-4d24-884d-9d003f269cd6.jpg?aki_policy=profile_x_medium,Baychester,4,4,"['email', 'phone', 'reviews', 'kba']",t,t,"Bronx, NY, United States",Baychester,Allerton,Bronx,Bronx,NY,10469,New York,"Bronx, NY",US,United States,40.86676961,-73.85937793,t,House,Private room,2,1.5,1,1,Real Bed,"{Internet,""Wireless Internet"",""Air conditioning"",Kitchen,""Free parking on premises"",""Buzzer/wireless intercom"",Heating,""Smoke detector"",""Carbon monoxide detector"",""First aid kit"",""Safety card"",""Fire extinguisher"",Essentials,Shampoo,""Lock on bedroom door"",Hangers,""Hair dryer"",Iron,""Laptop friendly workspace"",""translation missing: en.hosting_amenity_49"",""translation missing: en.hosting_amenity_50"",""Hot water"",""Bed linens"",""Extra pillows and blankets"",Microwave,Refrigerator,""Dishes and silverware"",""Cooking basics"",Oven,Stove,""Garden or backyard"",""Luggage dropoff allowed"",""Long term stays allowed"",""Cleaning before checkout"",""Wide hallway clearance"",""Well-lit path to entrance"",""Wide doorway"",""Accessible-height bed"",""Step-free access""}",,$44.00 ,$370.00 ,"$1,110.00 ",$0.00 ,$6.00 ,1,$12.00 ,2,30,5 days ago,t,14,44,71,339,10/3/17,72,7/5/14,9/21/17,91,9,9,10,10,9,9,f,,,t,f,strict,f,f,4,1.82
4407790,https://www.airbnb.com/rooms/4407790,2.0171E+13,10/2/17,Retreat Room,"A cool and comfortable room to retreat in at the end of the day. This room is spacious and can accommodate two people. It is near Jacobi hospital, Montefiore hospital, Einstein hospital, Fordham University, Lehman College, restaurants and stores. The room has windows, closet and a fan.","Welcome to our home! This is the clean, private room you've been searching for at a great price. Those who have stayed with us felt at home, you will too. We are near Jacobi hospital, Montefiore hospital, Albert Einstein College of Medicine, Fordham University  and Lehman college. Many restaurants and supermarkets are close by.","A cool and comfortable room to retreat in at the end of the day. This room is spacious and can accommodate two people. It is near Jacobi hospital, Montefiore hospital, Einstein hospital, Fordham University, Lehman College, restaurants and stores. The room has windows, closet and a fan. Welcome to our home! This is the clean, private room you've been searching for at a great price. Those who have stayed with us felt at home, you will too. We are near Jacobi hospital, Montefiore hospital, Albert Einstein College of Medicine, Fordham University  and Lehman college. Many restaurants and supermarkets are close by. WiFi, kitchen, Patio, backyard, living room, shared bathroom, free street parking, free tea/coffee, fresh towel and linen. As much as guests desire, will give them their space if they desire. Great neighborhood, safe, clean, peaceful. Near the train station, bus stop, stores, restaurants, Jacobi hospital, Montefiore hospital, Lehman college, Bay Plaza shopping mall and more. 10 mi",none,"Great neighborhood, safe, clean, peaceful. Near the train station, bus stop, stores, restaurants, Jacobi hospital, Montefiore hospital, Lehman college, Bay Plaza shopping mall and more.","Near Fordham University, Bronx Community College, Lehman College. Also near Montefiore hospital, Jacobi hospital.",10 min walk to  #2 train 3 min walk to bus 26 25 min to LGA airport 35 min to JFK 55 min to Newark airport Easy access to Manhattan and other areas,"WiFi, kitchen, Patio, backyard, living room, shared bathroom, free street parking, free tea/coffee, fresh towel and linen.","As much as guests desire, will give them their space if they desire.","Feel at home and comfortable, relax and enjoy your stay ABSOLUTELY NO SMOKING INSIDE OR OUTSIDE THE HOUSE. NO ILEGAL DRUG ACTIVITIES.  NO PETS No food in the rooms, please eat in the dinning room, drinks are ok  PLEASE Keep your room, kitchen and bathroom clean.  No curfew-you come and go anytime Conserve energy by turning the lights off when not in use. Please unplug all electrical devices when going out No shoes in the rooms, please bring a pair of socks or flip flops.  Thank you",https://a0.muscache.com/im/pictures/6c9b1ef8-41fd-4a6c-82cc-d681e48f6387.jpg?aki_policy=small,https://a0.muscache.com/im/pictures/6c9b1ef8-41fd-4a6c-82cc-d681e48f6387.jpg?aki_policy=medium,https://a0.muscache.com/im/pictures/6c9b1ef8-41fd-4a6c-82cc-d681e48f6387.jpg?aki_policy=large,https://a0.muscache.com/im/pictures/6c9b1ef8-41fd-4a6c-82cc-d681e48f6387.jpg?aki_policy=x_large,16286162,https://www.airbnb.com/users/show/16286162,Pat,6/2/14,"New York, New York, United States","HEY  I'M  PAT

 I enjoy the simple things in life, a positive person and always looking for the good in others. I love to travel,  entertain, outdoor activities, gardening, meet new people, exchange culture and our individual uniqueness.  I live in our private  house with my husband, daughter and older brother.
  I am a high school  Guidance Counselor.  I love  the bubbling life in New York City- ""the City that Never Sleeps"".

It has been a wonderful experience meeting  and hosting awesome guests from all walks of life. My family and i may not have traveled to all 5 continents that you all come from, but we have shared laughter, experiences  and pleasantries with you all because you chose to stay with us. THANK YOU.
 Looking forward to meeting our future  guests.

Please upload your photograph before booking.


",within an hour,100%,N/A,f,https://a0.muscache.com/im/pictures/9f6cea33-8e0f-4d24-884d-9d003f269cd6.jpg?aki_policy=profile_small,https://a0.muscache.com/im/pictures/9f6cea33-8e0f-4d24-884d-9d003f269cd6.jpg?aki_policy=profile_x_medium,Baychester,4,4,"['email', 'phone', 'reviews', 'kba']",t,t,"Bronx, NY, United States",Baychester,Allerton,Bronx,Bronx,NY,10469,New York,"Bronx, NY",US,United States,40.86681965,-73.85811594,t,House,Private room,2,1.5,1,1,Real Bed,"{TV,""Cable TV"",Internet,""Wireless Internet"",""Air conditioning"",Kitchen,""Free parking on premises"",""Buzzer/wireless intercom"",Heating,""Smoke detector"",""Carbon monoxide detector"",""First aid kit"",""Safety card"",""Fire extinguisher"",Essentials,Shampoo,""Lock on bedroom door"",Hangers,""Hair dryer"",Iron,""translation missing: en.hosting_amenity_49"",""translation missing: en.hosting_amenity_50"",""Hot water"",""Bed linens"",""Extra pillows and blankets"",Microwave,""Coffee maker"",Refrigerator,""Dishes and silverware"",Stove,""Garden or backyard"",""Luggage dropoff allowed"",""Cleaning before checkout""}",,$47.00 ,$305.00 ,$900.00 ,$0.00 ,$0.00 ,1,$12.00 ,2,30,4 days ago,t,17,35,44,130,10/2/17,35,11/1/14,5/5/17,95,9,9,10,10,9,10,f,,,t,f,moderate,f,f,4,0.98
715270,https://www.airbnb.com/rooms/715270,2.0171E+13,10/3/17,2 Beds/Queen & Full Beautiful Room 40 minsT.Square,"Located in one of the safest Bronx neighborhoods. One BEDROOM 2 beds / queens and  full size accommodates up to 3 Perfect for a sfamily  BIG Savings visiting the BIG APPLE.  Walk to Botanical Gardens, Bronx Zoo and Bronx Park….. Minutes from the Fordham University Bronx Campus ,  Arthur Avenue little Italy and Pelham Parkway.  Two blocks from the Subway (Train 2 and 5) and Express Bus to Manhattan. Top Kitchen Appliances WIFI Cable TV Third Floor BATHROOM AND KITCHEN are SHARED with other guest.","Located in one of the safest Bronx neighborhoods. Perfect for a family and group looking for BIG Savings visiting the BIG APPLE. Walk to Botanical Gardens, Bronx Zoo and Bronx Park….. Minutes from the Fordham University Bronx Campus , Famous Arthur Avenue little Italy and Pelham Parkway. Two blocks from the Subway (Train 2 and 5) and Express Bus to Manhattan. Top Kitchen Appliances and wood cabinets, granite counter top. WiFi Available  TV in the Living room and two Bedrooms THIRD FLOOR APT  Walking distance to Arthur Avenue, Botanical Gardens, Bronx Zoo. I am very Flexible with Check in check out time.","Located in one of the safest Bronx neighborhoods. One BEDROOM 2 beds / queens and  full size accommodates up to 3 Perfect for a sfamily  BIG Savings visiting the BIG APPLE.  Walk to Botanical Gardens, Bronx Zoo and Bronx Park….. Minutes from the Fordham University Bronx Campus ,  Arthur Avenue little Italy and Pelham Parkway.  Two blocks from the Subway (Train 2 and 5) and Express Bus to Manhattan. Top Kitchen Appliances WIFI Cable TV Third Floor BATHROOM AND KITCHEN are SHARED with other guest. Located in one of the safest Bronx neighborhoods. Perfect for a family and group looking for BIG Savings visiting the BIG APPLE. Walk to Botanical Gardens, Bronx Zoo and Bronx Park….. Minutes from the Fordham University Bronx Campus , Famous Arthur Avenue little Italy and Pelham Parkway. Two blocks from the Subway (Train 2 and 5) and Express Bus to Manhattan. Top Kitchen Appliances and wood cabinets, granite counter top. WiFi Available  TV in the Living room and two Bedrooms THIRD FLOOR APT  Wa",none,,,,no visitors without owners consent.,,"NO guests are allowed, NO  exceptions. You should  consult with me if you are bringing guests to the Apartment. NO SMOKING",https://a0.muscache.com/im/pictures/9fc810d5-e811-4851-b4a7-33a89e255902.jpg?aki_policy=small,https://a0.muscache.com/im/pictures/9fc810d5-e811-4851-b4a7-33a89e255902.jpg?aki_policy=medium,https://a0.muscache.com/im/pictures/9fc810d5-e811-4851-b4a7-33a89e255902.jpg?aki_policy=large,https://a0.muscache.com/im/pictures/9fc810d5-e811-4851-b4a7-33a89e255902.jpg?aki_policy=x_large,3684360,https://www.airbnb.com/users/show/3684360,Enrique,9/26/12,"New York, New York, United States","I am very friendly person.  I love to to travel, cook, and explore new places! Always up for an adventure, and love staying in nice apartments wherever I go! I  try to use Airbnb to professionally manage my apartment . You heard it here first: hotels are a thing of the past. Join the  sharing movement--safe travels!


",within an hour,100%,N/A,f,https://a0.muscache.com/im/users/3684360/profile_pic/1351002791/original.jpg?aki_policy=profile_small,https://a0.muscache.com/im/users/3684360/profile_pic/1351002791/original.jpg?aki_policy=profile_x_medium,Allerton,5,5,"['email', 'phone', 'reviews', 'sent_id']",t,t,"Bronx, NY, United States",Allerton,Allerton,Bronx,Bronx,NY,10467,New York,"Bronx, NY",US,United States,40.85955928,-73.87066898,t,Apartment,Private room,3,1,1,2,Real Bed,"{TV,Internet,""Wireless Internet"",""Air conditioning"",Kitchen,""Family/kid friendly"",""Smoke detector"",""First aid kit"",""Fire extinguisher""}",,$39.00 ,,,,$20.00 ,1,$9.00 ,2,365,today,t,19,49,79,354,10/3/17,131,10/20/12,9/15/17,90,9,9,9,9,9,9,f,,,f,f,strict,f,f,5,2.17
